<?xml version="1.0"?>
<!DOCTYPE magacin SYSTEM "magacin.dtd">
<magacin>
    <Artikal>
        <naziv sifra="001">Vafl</naziv>
        <datumIzrade>
            <dan>12</dan>
            <mesec>3</mesec>
            <godina>2019</godina>
        </datumIzrade>
        <cena valuta="RSD">20</cena>
        <kompanija>
            <ime>Swisslion</ime>
            <adresa>Takovo BB</adresa>
        </kompanija>
        <emailProdavca>Swisslion@gmail.com</emailProdavca>
    </Artikal>
</magacin>